[
  {
    "id": "worm_boss",
    "display_name": "Босс: Пожиратель плат (червь-летун)",
    "location_id": "loc_motherboard",
    "is_final_boss": false,
    "lore": "Огромный фиолетовый червь с рогатой головой и дрожащими щупальцами. Летает сквозь плату и камень, как рыба в воде, делает петли и проносится мимо добычи. Тело — десяток звеньев; пока ни на кого не нападает.",
    "stats": {
      "max_health": 250,
      "contact_damage": 0
    },
    "reward": {
      "item_type": "resistor",
      "item_id": "resistor_worm",
      "display_name": "Калибровочный резистор Пожирателя",
      "description": "Первый калибровочный резистор, стабилизирующий тактовую частоту шины хаба."
    },
    "attacks": [
      {
        "id": "ram_pass",
        "name": "Таранный пролёт",
        "damage": 0,
        "cooldown_seconds": 3.0,
        "projectile_type": "none",
        "description": "Летает за героем и делает петли, проносясь мимо и подставляя сегменты тела под удары."
      },
      {
        "id": "body_sweep",
        "name": "Взмах звеньями",
        "damage": 0,
        "cooldown_seconds": 4.5,
        "projectile_type": "none",
        "description": "Изгибает цепочку сегментов, окружая героя в пространстве арены."
      }
    ]
  }
]
